{"schema":"compileone/token-stream/1.0","phase":"lexical","language":"mini-c","source_file":"C:\\Users\\User\\AppData\\Local\\Temp\\opencode\\loop_probe.mc","generated_by":"compileone.exe v0.1.0 (flex)","duration_ms":1,"tokens":[{"id":1,"line":1,"column":1,"lexeme":"int","token":"KW_INT","category":"type","subtype":"type-specifier","length":3,"scope":"global","scope_level":0,"color":"#4ec9b0","description":"32-bit signed integer type specifier","offset":{"start":0,"end":3}},{"id":2,"line":1,"column":5,"lexeme":"i","token":"IDENTIFIER","category":"identifier","subtype":"user-identifier","length":1,"scope":"global","scope_level":0,"color":"#9cdcfe","description":"User-defined identifier","offset":{"start":4,"end":5}},{"id":3,"line":1,"column":7,"lexeme":"=","token":"OP_ASSIGN","category":"operator","subtype":"assignment","length":1,"scope":"global","scope_level":0,"color":"#d4d4d4","description":"Assignment operator","offset":{"start":6,"end":7}},{"id":4,"line":1,"column":9,"lexeme":"0","token":"INT_LITERAL","category":"literal","subtype":"integer","length":1,"scope":"global","scope_level":0,"color":"#b5cea8","description":"Integer literal constant","offset":{"start":8,"end":9}},{"id":5,"line":1,"column":10,"lexeme":";","token":"SEMICOLON","category":"delimiter","subtype":"statement","length":1,"scope":"global","scope_level":0,"color":"#d4d4d4","description":"Statement terminator","offset":{"start":9,"end":10}},{"id":6,"line":2,"column":1,"lexeme":"while","token":"KW_WHILE","category":"keyword","subtype":"control-flow","length":5,"scope":"global","scope_level":0,"color":"#569cd6","description":"Pre-test loop keyword","offset":{"start":11,"end":16}},{"id":7,"line":2,"column":7,"lexeme":"(","token":"LPAREN","category":"delimiter","subtype":"grouping","length":1,"scope":"global","scope_level":0,"color":"#d4d4d4","description":"Grouping / call delimiter (open)","offset":{"start":17,"end":18}},{"id":8,"line":2,"column":8,"lexeme":"i","token":"IDENTIFIER","category":"identifier","subtype":"user-identifier","length":1,"scope":"global","scope_level":0,"color":"#9cdcfe","description":"User-defined identifier","offset":{"start":18,"end":19}},{"id":9,"line":2,"column":10,"lexeme":"<","token":"OP_LT","category":"operator","subtype":"relational","length":1,"scope":"global","scope_level":0,"color":"#d4d4d4","description":"Relational less-than operator","offset":{"start":20,"end":21}},{"id":10,"line":2,"column":12,"lexeme":"3","token":"INT_LITERAL","category":"literal","subtype":"integer","length":1,"scope":"global","scope_level":0,"color":"#b5cea8","description":"Integer literal constant","offset":{"start":22,"end":23}},{"id":11,"line":2,"column":13,"lexeme":")","token":"RPAREN","category":"delimiter","subtype":"grouping","length":1,"scope":"global","scope_level":0,"color":"#d4d4d4","description":"Grouping / call delimiter (close)","offset":{"start":23,"end":24}},{"id":12,"line":2,"column":15,"lexeme":"{","token":"LBRACE","category":"delimiter","subtype":"block","length":1,"scope":"global","scope_level":0,"color":"#d4d4d4","description":"Block open delimiter","offset":{"start":25,"end":26}},{"id":13,"line":3,"column":5,"lexeme":"print","token":"KW_PRINT","category":"keyword","subtype":"output","length":5,"scope":"block:1","scope_level":1,"color":"#569cd6","description":"Output statement keyword (educational)","offset":{"start":31,"end":36}},{"id":14,"line":3,"column":11,"lexeme":"i","token":"IDENTIFIER","category":"identifier","subtype":"user-identifier","length":1,"scope":"block:1","scope_level":1,"color":"#9cdcfe","description":"User-defined identifier","offset":{"start":37,"end":38}},{"id":15,"line":3,"column":12,"lexeme":";","token":"SEMICOLON","category":"delimiter","subtype":"statement","length":1,"scope":"block:1","scope_level":1,"color":"#d4d4d4","description":"Statement terminator","offset":{"start":38,"end":39}},{"id":16,"line":4,"column":5,"lexeme":"i","token":"IDENTIFIER","category":"identifier","subtype":"user-identifier","length":1,"scope":"block:1","scope_level":1,"color":"#9cdcfe","description":"User-defined identifier","offset":{"start":44,"end":45}},{"id":17,"line":4,"column":7,"lexeme":"=","token":"OP_ASSIGN","category":"operator","subtype":"assignment","length":1,"scope":"block:1","scope_level":1,"color":"#d4d4d4","description":"Assignment operator","offset":{"start":46,"end":47}},{"id":18,"line":4,"column":9,"lexeme":"i","token":"IDENTIFIER","category":"identifier","subtype":"user-identifier","length":1,"scope":"block:1","scope_level":1,"color":"#9cdcfe","description":"User-defined identifier","offset":{"start":48,"end":49}},{"id":19,"line":4,"column":11,"lexeme":"+","token":"OP_ADD","category":"operator","subtype":"arithmetic","length":1,"scope":"block:1","scope_level":1,"color":"#d4d4d4","description":"Arithmetic addition operator","offset":{"start":50,"end":51}},{"id":20,"line":4,"column":13,"lexeme":"1","token":"INT_LITERAL","category":"literal","subtype":"integer","length":1,"scope":"block:1","scope_level":1,"color":"#b5cea8","description":"Integer literal constant","offset":{"start":52,"end":53}},{"id":21,"line":4,"column":14,"lexeme":";","token":"SEMICOLON","category":"delimiter","subtype":"statement","length":1,"scope":"block:1","scope_level":1,"color":"#d4d4d4","description":"Statement terminator","offset":{"start":53,"end":54}},{"id":22,"line":5,"column":1,"lexeme":"}","token":"RBRACE","category":"delimiter","subtype":"block","length":1,"scope":"block:1","scope_level":1,"color":"#d4d4d4","description":"Block close delimiter","offset":{"start":55,"end":56}},{"id":23,"line":6,"column":1,"lexeme":"print","token":"KW_PRINT","category":"keyword","subtype":"output","length":5,"scope":"global","scope_level":0,"color":"#569cd6","description":"Output statement keyword (educational)","offset":{"start":57,"end":62}},{"id":24,"line":6,"column":7,"lexeme":"i","token":"IDENTIFIER","category":"identifier","subtype":"user-identifier","length":1,"scope":"global","scope_level":0,"color":"#9cdcfe","description":"User-defined identifier","offset":{"start":63,"end":64}},{"id":25,"line":6,"column":8,"lexeme":";","token":"SEMICOLON","category":"delimiter","subtype":"statement","length":1,"scope":"global","scope_level":0,"color":"#d4d4d4","description":"Statement terminator","offset":{"start":64,"end":65}},{"id":26,"line":7,"column":1,"lexeme":"if","token":"KW_IF","category":"keyword","subtype":"control-flow","length":2,"scope":"global","scope_level":0,"color":"#569cd6","description":"Conditional branch keyword","offset":{"start":66,"end":68}},{"id":27,"line":7,"column":4,"lexeme":"(","token":"LPAREN","category":"delimiter","subtype":"grouping","length":1,"scope":"global","scope_level":0,"color":"#d4d4d4","description":"Grouping / call delimiter (open)","offset":{"start":69,"end":70}},{"id":28,"line":7,"column":5,"lexeme":"i","token":"IDENTIFIER","category":"identifier","subtype":"user-identifier","length":1,"scope":"global","scope_level":0,"color":"#9cdcfe","description":"User-defined identifier","offset":{"start":70,"end":71}},{"id":29,"line":7,"column":7,"lexeme":"<=","token":"OP_LE","category":"operator","subtype":"relational","length":2,"scope":"global","scope_level":0,"color":"#d4d4d4","description":"Relational less-than-or-equal operator","offset":{"start":72,"end":74}},{"id":30,"line":7,"column":10,"lexeme":"3","token":"INT_LITERAL","category":"literal","subtype":"integer","length":1,"scope":"global","scope_level":0,"color":"#b5cea8","description":"Integer literal constant","offset":{"start":75,"end":76}},{"id":31,"line":7,"column":11,"lexeme":")","token":"RPAREN","category":"delimiter","subtype":"grouping","length":1,"scope":"global","scope_level":0,"color":"#d4d4d4","description":"Grouping / call delimiter (close)","offset":{"start":76,"end":77}},{"id":32,"line":7,"column":13,"lexeme":"print","token":"KW_PRINT","category":"keyword","subtype":"output","length":5,"scope":"global","scope_level":0,"color":"#569cd6","description":"Output statement keyword (educational)","offset":{"start":78,"end":83}},{"id":33,"line":7,"column":19,"lexeme":"\"LE true\"","token":"STRING_LITERAL","category":"literal","subtype":"string","length":9,"scope":"global","scope_level":0,"color":"#ce9178","description":"String literal constant","offset":{"start":84,"end":93}},{"id":34,"line":7,"column":28,"lexeme":";","token":"SEMICOLON","category":"delimiter","subtype":"statement","length":1,"scope":"global","scope_level":0,"color":"#d4d4d4","description":"Statement terminator","offset":{"start":93,"end":94}},{"id":35,"line":7,"column":30,"lexeme":"else","token":"KW_ELSE","category":"keyword","subtype":"control-flow","length":4,"scope":"global","scope_level":0,"color":"#569cd6","description":"Alternate branch keyword","offset":{"start":95,"end":99}},{"id":36,"line":7,"column":35,"lexeme":"print","token":"KW_PRINT","category":"keyword","subtype":"output","length":5,"scope":"global","scope_level":0,"color":"#569cd6","description":"Output statement keyword (educational)","offset":{"start":100,"end":105}},{"id":37,"line":7,"column":41,"lexeme":"\"LE false\"","token":"STRING_LITERAL","category":"literal","subtype":"string","length":10,"scope":"global","scope_level":0,"color":"#ce9178","description":"String literal constant","offset":{"start":106,"end":116}},{"id":38,"line":7,"column":51,"lexeme":";","token":"SEMICOLON","category":"delimiter","subtype":"statement","length":1,"scope":"global","scope_level":0,"color":"#d4d4d4","description":"Statement terminator","offset":{"start":116,"end":117}}],"statistics":{"total":38,"by_category":{"keyword":7,"type":1,"identifier":7,"literal":6,"operator":5,"delimiter":12,"comment":0,"error":0}},"errors":[]}