{"schema":"compileone/token-stream/1.0","phase":"lexical","language":"mini-c","source_file":".\\Temp\\compileone_working.mc","generated_by":"compileone.exe v0.1.0 (flex)","duration_ms":0,"tokens":[{"id":1,"line":1,"column":1,"lexeme":"#","token":"LEX_ERROR","category":"error","subtype":"lexical","length":1,"scope":"global","scope_level":0,"color":"#f44747","description":"Character not valid in this language","offset":{"start":0,"end":1}},{"id":2,"line":1,"column":2,"lexeme":"include","token":"IDENTIFIER","category":"identifier","subtype":"user-identifier","length":7,"scope":"global","scope_level":0,"color":"#9cdcfe","description":"User-defined identifier","offset":{"start":1,"end":8}},{"id":3,"line":1,"column":10,"lexeme":"<","token":"OP_LT","category":"operator","subtype":"relational","length":1,"scope":"global","scope_level":0,"color":"#d4d4d4","description":"Relational less-than operator","offset":{"start":9,"end":10}},{"id":4,"line":1,"column":11,"lexeme":"stdio","token":"IDENTIFIER","category":"identifier","subtype":"user-identifier","length":5,"scope":"global","scope_level":0,"color":"#9cdcfe","description":"User-defined identifier","offset":{"start":10,"end":15}},{"id":5,"line":1,"column":16,"lexeme":".","token":"OP_DOT","category":"operator","subtype":"member-access","length":1,"scope":"global","scope_level":0,"color":"#d4d4d4","description":"Java member access operator","offset":{"start":15,"end":16}},{"id":6,"line":1,"column":17,"lexeme":"h","token":"IDENTIFIER","category":"identifier","subtype":"user-identifier","length":1,"scope":"global","scope_level":0,"color":"#9cdcfe","description":"User-defined identifier","offset":{"start":16,"end":17}},{"id":7,"line":1,"column":18,"lexeme":">","token":"OP_GT","category":"operator","subtype":"relational","length":1,"scope":"global","scope_level":0,"color":"#d4d4d4","description":"Relational greater-than operator","offset":{"start":17,"end":18}},{"id":8,"line":3,"column":1,"lexeme":"int","token":"KW_INT","category":"type","subtype":"type-specifier","length":3,"scope":"global","scope_level":0,"color":"#4ec9b0","description":"32-bit signed integer type specifier","offset":{"start":22,"end":25}},{"id":9,"line":3,"column":5,"lexeme":"main","token":"IDENTIFIER","category":"identifier","subtype":"user-identifier","length":4,"scope":"global","scope_level":0,"color":"#9cdcfe","description":"User-defined identifier","offset":{"start":26,"end":30}},{"id":10,"line":3,"column":9,"lexeme":"(","token":"LPAREN","category":"delimiter","subtype":"grouping","length":1,"scope":"global","scope_level":0,"color":"#d4d4d4","description":"Grouping / call delimiter (open)","offset":{"start":30,"end":31}},{"id":11,"line":3,"column":10,"lexeme":")","token":"RPAREN","category":"delimiter","subtype":"grouping","length":1,"scope":"global","scope_level":0,"color":"#d4d4d4","description":"Grouping / call delimiter (close)","offset":{"start":31,"end":32}},{"id":12,"line":4,"column":1,"lexeme":"{","token":"LBRACE","category":"delimiter","subtype":"block","length":1,"scope":"global","scope_level":0,"color":"#d4d4d4","description":"Block open delimiter","offset":{"start":34,"end":35}},{"id":13,"line":5,"column":5,"lexeme":"printf","token":"IDENTIFIER","category":"identifier","subtype":"user-identifier","length":6,"scope":"block:1","scope_level":1,"color":"#9cdcfe","description":"User-defined identifier","offset":{"start":41,"end":47}},{"id":14,"line":5,"column":11,"lexeme":"(","token":"LPAREN","category":"delimiter","subtype":"grouping","length":1,"scope":"block:1","scope_level":1,"color":"#d4d4d4","description":"Grouping / call delimiter (open)","offset":{"start":47,"end":48}},{"id":15,"line":5,"column":12,"lexeme":"\"Hello CompileOne\\n\"","token":"STRING_LITERAL","category":"literal","subtype":"string","length":20,"scope":"block:1","scope_level":1,"color":"#ce9178","description":"String literal constant","offset":{"start":48,"end":68}},{"id":16,"line":5,"column":32,"lexeme":")","token":"RPAREN","category":"delimiter","subtype":"grouping","length":1,"scope":"block:1","scope_level":1,"color":"#d4d4d4","description":"Grouping / call delimiter (close)","offset":{"start":68,"end":69}},{"id":17,"line":5,"column":33,"lexeme":";","token":"SEMICOLON","category":"delimiter","subtype":"statement","length":1,"scope":"block:1","scope_level":1,"color":"#d4d4d4","description":"Statement terminator","offset":{"start":69,"end":70}},{"id":18,"line":6,"column":5,"lexeme":"return","token":"KW_RETURN","category":"keyword","subtype":"control-flow","length":6,"scope":"block:1","scope_level":1,"color":"#569cd6","description":"Return-from-function keyword","offset":{"start":76,"end":82}},{"id":19,"line":6,"column":12,"lexeme":"0","token":"INT_LITERAL","category":"literal","subtype":"integer","length":1,"scope":"block:1","scope_level":1,"color":"#b5cea8","description":"Integer literal constant","offset":{"start":83,"end":84}},{"id":20,"line":6,"column":13,"lexeme":";","token":"SEMICOLON","category":"delimiter","subtype":"statement","length":1,"scope":"block:1","scope_level":1,"color":"#d4d4d4","description":"Statement terminator","offset":{"start":84,"end":85}},{"id":21,"line":7,"column":1,"lexeme":"}","token":"RBRACE","category":"delimiter","subtype":"block","length":1,"scope":"block:1","scope_level":1,"color":"#d4d4d4","description":"Block close delimiter","offset":{"start":87,"end":88}}],"statistics":{"total":21,"by_category":{"keyword":1,"type":1,"identifier":5,"literal":2,"operator":3,"delimiter":8,"comment":0,"error":1}},"errors":[{"line":1,"column":1,"lexeme":"#","message":"Unknown character"}]}