{"schema":"compileone/token-stream/1.0","phase":"lexical","language":"mini-c","source_file":"examples/study/hello.mc","generated_by":"compileone.exe v0.1.0 (flex)","duration_ms":1,"tokens":[{"id":1,"line":1,"column":1,"lexeme":"// hello.mc — first mini-c program","token":"COMMENT","category":"comment","subtype":"comment","length":36,"scope":"global","scope_level":0,"color":"#6a9955","description":"Source comment (skipped by the parser)","offset":{"start":0,"end":36}},{"id":2,"line":2,"column":1,"lexeme":"print","token":"KW_PRINT","category":"keyword","subtype":"output","length":5,"scope":"global","scope_level":0,"color":"#569cd6","description":"Output statement keyword (educational)","offset":{"start":37,"end":42}},{"id":3,"line":2,"column":7,"lexeme":"1","token":"INT_LITERAL","category":"literal","subtype":"integer","length":1,"scope":"global","scope_level":0,"color":"#b5cea8","description":"Integer literal constant","offset":{"start":43,"end":44}},{"id":4,"line":2,"column":9,"lexeme":"+","token":"OP_ADD","category":"operator","subtype":"arithmetic","length":1,"scope":"global","scope_level":0,"color":"#d4d4d4","description":"Arithmetic addition operator","offset":{"start":45,"end":46}},{"id":5,"line":2,"column":11,"lexeme":"2","token":"INT_LITERAL","category":"literal","subtype":"integer","length":1,"scope":"global","scope_level":0,"color":"#b5cea8","description":"Integer literal constant","offset":{"start":47,"end":48}},{"id":6,"line":2,"column":13,"lexeme":"*","token":"OP_MUL","category":"operator","subtype":"arithmetic","length":1,"scope":"global","scope_level":0,"color":"#d4d4d4","description":"Arithmetic multiplication operator","offset":{"start":49,"end":50}},{"id":7,"line":2,"column":15,"lexeme":"3","token":"INT_LITERAL","category":"literal","subtype":"integer","length":1,"scope":"global","scope_level":0,"color":"#b5cea8","description":"Integer literal constant","offset":{"start":51,"end":52}},{"id":8,"line":2,"column":16,"lexeme":";","token":"SEMICOLON","category":"delimiter","subtype":"statement","length":1,"scope":"global","scope_level":0,"color":"#d4d4d4","description":"Statement terminator","offset":{"start":52,"end":53}},{"id":9,"line":3,"column":1,"lexeme":"print","token":"KW_PRINT","category":"keyword","subtype":"output","length":5,"scope":"global","scope_level":0,"color":"#569cd6","description":"Output statement keyword (educational)","offset":{"start":54,"end":59}},{"id":10,"line":3,"column":7,"lexeme":"(","token":"LPAREN","category":"delimiter","subtype":"grouping","length":1,"scope":"global","scope_level":0,"color":"#d4d4d4","description":"Grouping / call delimiter (open)","offset":{"start":60,"end":61}},{"id":11,"line":3,"column":8,"lexeme":"1","token":"INT_LITERAL","category":"literal","subtype":"integer","length":1,"scope":"global","scope_level":0,"color":"#b5cea8","description":"Integer literal constant","offset":{"start":61,"end":62}},{"id":12,"line":3,"column":10,"lexeme":"+","token":"OP_ADD","category":"operator","subtype":"arithmetic","length":1,"scope":"global","scope_level":0,"color":"#d4d4d4","description":"Arithmetic addition operator","offset":{"start":63,"end":64}},{"id":13,"line":3,"column":12,"lexeme":"2","token":"INT_LITERAL","category":"literal","subtype":"integer","length":1,"scope":"global","scope_level":0,"color":"#b5cea8","description":"Integer literal constant","offset":{"start":65,"end":66}},{"id":14,"line":3,"column":13,"lexeme":")","token":"RPAREN","category":"delimiter","subtype":"grouping","length":1,"scope":"global","scope_level":0,"color":"#d4d4d4","description":"Grouping / call delimiter (close)","offset":{"start":66,"end":67}},{"id":15,"line":3,"column":15,"lexeme":"*","token":"OP_MUL","category":"operator","subtype":"arithmetic","length":1,"scope":"global","scope_level":0,"color":"#d4d4d4","description":"Arithmetic multiplication operator","offset":{"start":68,"end":69}},{"id":16,"line":3,"column":17,"lexeme":"3","token":"INT_LITERAL","category":"literal","subtype":"integer","length":1,"scope":"global","scope_level":0,"color":"#b5cea8","description":"Integer literal constant","offset":{"start":70,"end":71}},{"id":17,"line":3,"column":18,"lexeme":";","token":"SEMICOLON","category":"delimiter","subtype":"statement","length":1,"scope":"global","scope_level":0,"color":"#d4d4d4","description":"Statement terminator","offset":{"start":71,"end":72}}],"statistics":{"total":17,"by_category":{"keyword":2,"type":0,"identifier":0,"literal":6,"operator":4,"delimiter":4,"comment":1,"error":0}},"errors":[]}