{
  "schema": "compileone/token-stream/1.0",
  "phase": "lexical",
  "language": "mini-c",
  "source_file": "C:\\Users\\User\\OneDrive - LP Industries\\Documents\\Limon\\Projects\\CompileOne\\Temp\\compileone_source.mc",
  "generated_by": "compileone.exe v0.1.0 (flex)",
  "duration_ms": 0,
  "tokens": [],
  "statistics": {
    "total": 0,
    "by_category": {
      "keyword": 0,
      "type": 0,
      "identifier": 0,
      "literal": 0,
      "operator": 0,
      "delimiter": 0,
      "comment": 0,
      "error": 0
    }
  },
  "errors": []
}