{"schema":"compileone/token-stream/1.0","phase":"lexical","language":"java","source_file":"Temp\\mini.java","generated_by":"compileone.exe v0.1.0 (flex)","duration_ms":0,"tokens":[{"id":1,"line":1,"column":1,"lexeme":"public","token":"KW_PUBLIC","category":"keyword","subtype":"access","length":6,"scope":"global","scope_level":0,"color":"#569cd6","description":"Public access modifier","offset":{"start":0,"end":6}},{"id":2,"line":1,"column":8,"lexeme":"class","token":"KW_CLASS","category":"keyword","subtype":"type","length":5,"scope":"global","scope_level":0,"color":"#569cd6","description":"Class definition keyword (C++/Java)","offset":{"start":7,"end":12}},{"id":3,"line":1,"column":14,"lexeme":"Foo","token":"IDENTIFIER","category":"identifier","subtype":"user-identifier","length":3,"scope":"global","scope_level":0,"color":"#9cdcfe","description":"User-defined identifier","offset":{"start":13,"end":16}},{"id":4,"line":1,"column":18,"lexeme":"{","token":"LBRACE","category":"delimiter","subtype":"block","length":1,"scope":"global","scope_level":0,"color":"#d4d4d4","description":"Block open delimiter","offset":{"start":17,"end":18}},{"id":5,"line":2,"column":3,"lexeme":"public","token":"KW_PUBLIC","category":"keyword","subtype":"access","length":6,"scope":"block:1","scope_level":1,"color":"#569cd6","description":"Public access modifier","offset":{"start":21,"end":27}},{"id":6,"line":2,"column":10,"lexeme":"static","token":"KW_STATIC","category":"keyword","subtype":"storage","length":6,"scope":"block:1","scope_level":1,"color":"#569cd6","description":"Static storage/scope modifier","offset":{"start":28,"end":34}},{"id":7,"line":2,"column":17,"lexeme":"void","token":"KW_VOID","category":"type","subtype":"type-specifier","length":4,"scope":"block:1","scope_level":1,"color":"#4ec9b0","description":"Void type specifier (no value)","offset":{"start":35,"end":39}},{"id":8,"line":2,"column":22,"lexeme":"main","token":"IDENTIFIER","category":"identifier","subtype":"user-identifier","length":4,"scope":"block:1","scope_level":1,"color":"#9cdcfe","description":"User-defined identifier","offset":{"start":40,"end":44}},{"id":9,"line":2,"column":26,"lexeme":"(","token":"LPAREN","category":"delimiter","subtype":"grouping","length":1,"scope":"block:1","scope_level":1,"color":"#d4d4d4","description":"Grouping / call delimiter (open)","offset":{"start":44,"end":45}},{"id":10,"line":2,"column":27,"lexeme":"String","token":"KW_STRING","category":"type","subtype":"type-specifier","length":6,"scope":"block:1","scope_level":1,"color":"#4ec9b0","description":"String type specifier (Java)","offset":{"start":45,"end":51}},{"id":11,"line":2,"column":33,"lexeme":"[","token":"LBRACKET","category":"delimiter","subtype":"array","length":1,"scope":"block:1","scope_level":1,"color":"#d4d4d4","description":"Array subscript delimiter (open)","offset":{"start":51,"end":52}},{"id":12,"line":2,"column":34,"lexeme":"]","token":"RBRACKET","category":"delimiter","subtype":"array","length":1,"scope":"block:1","scope_level":1,"color":"#d4d4d4","description":"Array subscript delimiter (close)","offset":{"start":52,"end":53}},{"id":13,"line":2,"column":36,"lexeme":"args","token":"IDENTIFIER","category":"identifier","subtype":"user-identifier","length":4,"scope":"block:1","scope_level":1,"color":"#9cdcfe","description":"User-defined identifier","offset":{"start":54,"end":58}},{"id":14,"line":2,"column":40,"lexeme":")","token":"RPAREN","category":"delimiter","subtype":"grouping","length":1,"scope":"block:1","scope_level":1,"color":"#d4d4d4","description":"Grouping / call delimiter (close)","offset":{"start":58,"end":59}},{"id":15,"line":2,"column":42,"lexeme":"{","token":"LBRACE","category":"delimiter","subtype":"block","length":1,"scope":"block:1","scope_level":1,"color":"#d4d4d4","description":"Block open delimiter","offset":{"start":60,"end":61}},{"id":16,"line":3,"column":5,"lexeme":"System","token":"IDENTIFIER","category":"identifier","subtype":"user-identifier","length":6,"scope":"block:2","scope_level":2,"color":"#9cdcfe","description":"User-defined identifier","offset":{"start":66,"end":72}},{"id":17,"line":3,"column":11,"lexeme":".","token":"OP_DOT","category":"operator","subtype":"member","length":1,"scope":"block:2","scope_level":2,"color":"#d4d4d4","description":"Member/field access operator (C/C++)","offset":{"start":72,"end":73}},{"id":18,"line":3,"column":12,"lexeme":"out","token":"IDENTIFIER","category":"identifier","subtype":"user-identifier","length":3,"scope":"block:2","scope_level":2,"color":"#9cdcfe","description":"User-defined identifier","offset":{"start":73,"end":76}},{"id":19,"line":3,"column":15,"lexeme":".","token":"OP_DOT","category":"operator","subtype":"member","length":1,"scope":"block:2","scope_level":2,"color":"#d4d4d4","description":"Member/field access operator (C/C++)","offset":{"start":76,"end":77}},{"id":20,"line":3,"column":16,"lexeme":"println","token":"IDENTIFIER","category":"identifier","subtype":"user-identifier","length":7,"scope":"block:2","scope_level":2,"color":"#9cdcfe","description":"User-defined identifier","offset":{"start":77,"end":84}},{"id":21,"line":3,"column":23,"lexeme":"(","token":"LPAREN","category":"delimiter","subtype":"grouping","length":1,"scope":"block:2","scope_level":2,"color":"#d4d4d4","description":"Grouping / call delimiter (open)","offset":{"start":84,"end":85}},{"id":22,"line":3,"column":24,"lexeme":"\"hi\"","token":"STRING_LITERAL","category":"literal","subtype":"string","length":4,"scope":"block:2","scope_level":2,"color":"#ce9178","description":"String literal constant","offset":{"start":85,"end":89}},{"id":23,"line":3,"column":28,"lexeme":")","token":"RPAREN","category":"delimiter","subtype":"grouping","length":1,"scope":"block:2","scope_level":2,"color":"#d4d4d4","description":"Grouping / call delimiter (close)","offset":{"start":89,"end":90}},{"id":24,"line":3,"column":29,"lexeme":";","token":"SEMICOLON","category":"delimiter","subtype":"statement","length":1,"scope":"block:2","scope_level":2,"color":"#d4d4d4","description":"Statement terminator","offset":{"start":90,"end":91}},{"id":25,"line":4,"column":3,"lexeme":"}","token":"RBRACE","category":"delimiter","subtype":"block","length":1,"scope":"block:2","scope_level":2,"color":"#d4d4d4","description":"Block close delimiter","offset":{"start":94,"end":95}},{"id":26,"line":5,"column":1,"lexeme":"}","token":"RBRACE","category":"delimiter","subtype":"block","length":1,"scope":"block:1","scope_level":1,"color":"#d4d4d4","description":"Block close delimiter","offset":{"start":96,"end":97}}],"statistics":{"total":26,"by_category":{"keyword":4,"type":2,"identifier":6,"literal":1,"operator":2,"delimiter":11,"comment":0,"error":0}},"errors":[]}