{"schema":"compileone/token-stream/1.0","phase":"lexical","language":"mini-c","source_file":"C:\\Users\\User\\AppData\\Local\\Temp\\opencode\\crlf_test.mc","generated_by":"compileone.exe v0.1.0 (flex)","duration_ms":38,"tokens":[{"id":1,"line":1,"column":1,"lexeme":"// hello world","token":"COMMENT","category":"comment","subtype":"comment","length":14,"scope":"global","scope_level":0,"color":"#6a9955","description":"Source comment (skipped by the parser)","offset":{"start":0,"end":14}},{"id":2,"line":2,"column":1,"lexeme":"print","token":"KW_PRINT","category":"keyword","subtype":"output","length":5,"scope":"global","scope_level":0,"color":"#569cd6","description":"Output statement keyword (educational)","offset":{"start":16,"end":21}},{"id":3,"line":2,"column":7,"lexeme":"1","token":"INT_LITERAL","category":"literal","subtype":"integer","length":1,"scope":"global","scope_level":0,"color":"#b5cea8","description":"Integer literal constant","offset":{"start":22,"end":23}},{"id":4,"line":2,"column":8,"lexeme":";","token":"SEMICOLON","category":"delimiter","subtype":"statement","length":1,"scope":"global","scope_level":0,"color":"#d4d4d4","description":"Statement terminator","offset":{"start":23,"end":24}}],"statistics":{"total":4,"by_category":{"keyword":1,"type":0,"identifier":0,"literal":1,"operator":0,"delimiter":1,"comment":1,"error":0}},"errors":[]}